{
  "$schema": "../../../../schemas/case.schema.json",
  "id": "playground/threading",
  "languageVersion": "legacy-sweetjs",
  "typescriptVersion": "pinned",
  "compilerOptions": {
    "strict": true
  },
  "capabilities": [
    "PLAYGROUND-THREADING",
    "PAT-EXPR",
    "PAT-REP-SEP",
    "EXP-RECURSION",
    "HYG-CAPTURE-PRESERVE"
  ],
  "entry": "acceptance.sts",
  "expect": {
    "expansion": true,
    "bindings": true,
    "trace": true,
    "diagnostics": true,
    "types": true,
    "runtime": true
  },
  "limits": {}
}
