{
  "$schema": "../../../../schemas/case.schema.json",
  "id": "playground/adt",
  "languageVersion": "legacy-sweetjs",
  "typescriptVersion": "pinned",
  "compilerOptions": {
    "strict": true
  },
  "capabilities": [
    "PLAYGROUND-ADT",
    "PAT-REP-NESTED",
    "TPL-TOKEN-TEXT",
    "TPL-FOLD",
    "BIND-DECLARATION",
    "BIND-PATTERN"
  ],
  "entry": "acceptance.sts",
  "expect": {
    "expansion": true,
    "bindings": true,
    "trace": true,
    "diagnostics": true,
    "types": true,
    "runtime": true
  },
  "limits": {}
}
