{
  "$schema": "../../../../schemas/case.schema.json",
  "id": "playground/csp",
  "languageVersion": "legacy-sweetjs",
  "typescriptVersion": "pinned",
  "compilerOptions": {
    "strict": true
  },
  "capabilities": [
    "PLAYGROUND-CSP",
    "OP-PUNCTUATION",
    "OP-INFIX-FIXITY",
    "BIND-OPERATOR",
    "CTX-YIELD"
  ],
  "entry": "acceptance.sts",
  "expect": {
    "expansion": true,
    "bindings": true,
    "trace": true,
    "diagnostics": true,
    "types": true,
    "runtime": true
  },
  "limits": {}
}
