{
  "$schema": "../../../../schemas/case.schema.json",
  "id": "playground/multi-part-methods",
  "languageVersion": "legacy-sweetjs",
  "typescriptVersion": "pinned",
  "compilerOptions": {
    "strict": true
  },
  "capabilities": [
    "PLAYGROUND-MIXFIX",
    "PAT-MIXFIX",
    "PAT-REP-NESTED",
    "EXP-GENERATED-SYNTAX",
    "HYG-BINDING-DECLARATION"
  ],
  "entry": "acceptance.sts",
  "expect": {
    "expansion": true,
    "bindings": true,
    "trace": true,
    "diagnostics": true,
    "types": true,
    "runtime": true
  },
  "limits": {}
}
