{
  "$schema": "../../../../schemas/case.schema.json",
  "id": "playground/rewritten-if",
  "languageVersion": "legacy-sweetjs",
  "typescriptVersion": "pinned",
  "compilerOptions": {
    "strict": true
  },
  "capabilities": [
    "PLAYGROUND-REWRITTEN-IF",
    "CORE-SHADOW-LEXICAL",
    "PAT-BLOCK-STRUCTURE",
    "ENF-EXPR-EXTENT",
    "HYG-DEFINITION-REFERENCE"
  ],
  "entry": "acceptance.sts",
  "expect": {
    "expansion": true,
    "bindings": true,
    "trace": true,
    "diagnostics": true,
    "types": true,
    "runtime": true
  },
  "limits": {}
}
