{
  "$schema": "../../../../schemas/case.schema.json",
  "id": "playground/core-rewrites",
  "languageVersion": "legacy-sweetjs",
  "typescriptVersion": "pinned",
  "compilerOptions": {
    "strict": true
  },
  "capabilities": [
    "PLAYGROUND-CORE-REWRITE",
    "CORE-SHADOW-LEXICAL",
    "PAT-BINDING-LITERAL",
    "CTX-FUNCTION-ARITY",
    "HYG-DEFINITION-REFERENCE"
  ],
  "entry": "acceptance.sts",
  "expect": {
    "expansion": true,
    "bindings": true,
    "trace": true,
    "diagnostics": true,
    "types": true,
    "runtime": true
  },
  "limits": {}
}
