{
  "$schema": "../../../../schemas/case.schema.json",
  "id": "playground/currying",
  "languageVersion": "legacy-sweetjs",
  "typescriptVersion": "pinned",
  "compilerOptions": {
    "strict": true
  },
  "capabilities": [
    "PLAYGROUND-CURRYING",
    "CORE-SHADOW-LEXICAL",
    "PAT-REP-CORRELATED",
    "TPL-GENERATED-OVERLOADS",
    "HYG-BINDING-DECLARATION"
  ],
  "entry": "acceptance.sts",
  "expect": {
    "expansion": true,
    "bindings": true,
    "trace": true,
    "diagnostics": true,
    "types": true,
    "runtime": true
  },
  "limits": {}
}
